{
  "capability": "front-matter-document",
  "description": "Emits the authors array even when taxonomies are empty.",
  "expected": {
    "ok": true,
    "value": {
      "text": "+++\ntitle = \"Authors\"\ndate = 2026-03-09\nauthors = [\"作者\"]\n+++"
    }
  },
  "id": "front-toml-authors-only-render",
  "input": {
    "document": {
      "authors": [
        "作者"
      ],
      "bodyMarkdown": "Body",
      "categories": [],
      "formattedDate": "2026-03-09",
      "syntax": "toml",
      "tags": [],
      "taxonomyLayout": "inlineTable",
      "title": "Authors",
      "writesCoverInExtraTable": false
    },
    "operation": "render"
  },
  "validity": "valid"
}
