{
  "capability": "front-matter-document",
  "description": "Assembles TOML front matter with a trimmed body and trailing LF.",
  "expected": {
    "ok": true,
    "value": {
      "text": "+++\ntitle = \"TOML body\"\ndate = 2026-03-08\n+++\n\nBody\n"
    }
  },
  "id": "front-toml-markdown-trim",
  "input": {
    "document": {
      "authors": [],
      "bodyMarkdown": "\n Body \n",
      "categories": [],
      "formattedDate": "2026-03-08",
      "syntax": "toml",
      "tags": [],
      "taxonomyLayout": "table",
      "title": "TOML body",
      "writesCoverInExtraTable": false
    },
    "operation": "markdown-document"
  },
  "validity": "valid"
}
