{
  "capability": "repository-endpoint",
  "description": "Allows a null URLQueryItem value and emits its key without an equals sign.",
  "expected": {
    "ok": true,
    "value": {
      "absoluteURL": "https://api.example.test/search?ref"
    }
  },
  "id": "endpoint-query-null-value",
  "input": {
    "baseURL": "https://api.example.test",
    "operation": "build-url",
    "path": "search",
    "queryItems": [
      {
        "name": "ref",
        "value": null
      }
    ]
  },
  "validity": "valid"
}
