{
  "capability": "publish-conflict-diff",
  "description": "Reports the empty local line after a remote line.",
  "expected": {
    "ok": true,
    "value": {
      "lines": [
        {
          "id": 0,
          "kind": "remote",
          "marker": "-",
          "text": "line"
        },
        {
          "id": 1,
          "kind": "local",
          "marker": "+",
          "text": ""
        }
      ],
      "strategy": "lcs"
    }
  },
  "id": "diff-empty-local",
  "input": {
    "local": "",
    "remote": "line"
  },
  "validity": "valid"
}
