{
  "capability": "repository-endpoint",
  "description": "Accepts the default HTTPS API host.",
  "expected": {
    "ok": true,
    "value": {
      "baseURL": "https://api.example.test"
    }
  },
  "id": "endpoint-default-validate",
  "input": {
    "baseURL": "https://api.example.test",
    "operation": "validate"
  },
  "validity": "valid"
}
