{
  "capability": "repository-endpoint",
  "description": "Builds a request URL from the default base host.",
  "expected": {
    "ok": true,
    "value": {
      "absoluteURL": "https://api.example.test/repos/acme/site/contents/index.md"
    }
  },
  "id": "endpoint-default-build-url",
  "input": {
    "baseURL": "https://api.example.test",
    "operation": "build-url",
    "path": "/repos/acme/site/contents/index.md"
  },
  "validity": "valid"
}
