{
  "capability": "repository-endpoint",
  "description": "Avoids duplicate slashes when both base and request paths have slashes.",
  "expected": {
    "ok": true,
    "value": {
      "absoluteURL": "https://api.example.test/api/repos/a/b"
    }
  },
  "id": "endpoint-trailing-slash",
  "input": {
    "baseURL": "https://api.example.test/api/",
    "operation": "build-url",
    "path": "/repos/a/b/"
  },
  "validity": "valid"
}
