{
  "capability": "repository-endpoint",
  "description": "Treats a slash-only request path as the base endpoint path.",
  "expected": {
    "ok": true,
    "value": {
      "absoluteURL": "https://api.example.test/api"
    }
  },
  "id": "endpoint-empty-request-path",
  "input": {
    "baseURL": "https://api.example.test/api",
    "operation": "build-url",
    "path": "/"
  },
  "validity": "valid"
}
