{
  "capability": "repository-endpoint",
  "description": "Keeps a percent-encoded slash in a request path.",
  "expected": {
    "ok": true,
    "value": {
      "absoluteURL": "https://api.example.test/repos/acme/site/contents/docs%2Fguide.md"
    }
  },
  "id": "endpoint-encoded-request-path",
  "input": {
    "baseURL": "https://api.example.test",
    "operation": "build-url",
    "path": "repos/acme/site/contents/docs%2Fguide.md"
  },
  "validity": "valid"
}
